Slug,Title,Logo,Main Image,Short Description,Project URL,Content,Sort Order,Tags
data-sense-ai,DataSense Ai,/data-sense.svg?height=64&width=64&query=datasense ai logo,/portfolio-images/project-ph-1.png,Smart AI analytics for every dataset,https://example.com,"<h3>Project Overview</h3><p><strong>DataSense AI</strong> is an AI-powered business intelligence platform designed to transform raw datasets into actionable insights within minutes. Users can securely upload CSV files, after which the system performs intelligent preprocessing — including privacy-sensitive data removal, normalization, and feature enhancement. Once cleaned, the processed dataset is automatically uploaded to Supabase for secure storage, and users can seamlessly visualize insights through tools like Tableau and Power BI. <strong>Due to NDA constraints, the actual project name and UI images cannot be disclosed.</strong></p> <h3>Key Features</h3> <ul> <li>AI-driven data preprocessing (auto-cleaning, privacy filtering, normalization)</li> <li>Automated upload to Supabase for secure, scalable storage</li> <li>Seamless integration with Tableau and Power BI for advanced analytics</li> <li>KPI Layer Generator — AI automatically creates dashboards and insight-rich views</li> <li>AI conversational analytics bot for natural-language querying of datasets</li> <li>Automated anomaly detection and intelligent recommendations</li> <li>End-to-end data pipeline with strong privacy and enterprise-grade scalability</li> </ul> <h3>Technologies Used</h3> <p>The platform is built using Next.js, Node.js, Supabase, and OpenAI's API for preprocessing, insight generation, and conversational analytics. It supports large dataset uploads, ensures strict privacy handling, and delivers fast, AI-powered KPI dashboards and chatbot-driven insights.</p>",2024-01-15,"AI,Web App"
song-ai,Song Ai,/song-ai.svg?height=64&width=64&query=song ai logo,/portfolio-images/gigs-2.png,AI-Powered Songwriting Made Easy.,https://example.com,"<h3>Project Overview</h3><p><strong>Song AI</strong> is an AI-powered songwriting assistant designed to help creators generate full songs, including lyrics, melodies, and structured verses, in minutes. Users can input themes, moods, or keywords, after which the system performs intelligent song generation — including rhyme optimization, melody suggestions, and verse-chorus structuring. The generated songs can be saved, exported, or refined further using the platform's AI tools. <strong>Due to NDA constraints, the actual project name and UI images cannot be disclosed.</strong></p> <h3>Key Features</h3> <ul> <li>AI-powered lyric generation based on themes, moods, and keywords</li> <li>Automatic verse, chorus, and bridge structuring for complete songs</li> <li>Rhyme and rhythm optimization for catchy, natural lyrics</li> <li>Melody suggestions and chord progression guidance</li> <li>Interactive AI refinement for edits and creative inspiration</li> <li>Export options for text, sheet music, or DAW-ready formats</li> <li>End-to-end songwriting workflow with fast, AI-assisted creativity</li> </ul> <h3>Technologies Used</h3> <p>The platform is built using Next.js, Node.js, Supabase, and OpenAI's API for lyric generation, melody assistance, and interactive refinement. It supports secure storage of user creations, fast AI-powered song generation, and intuitive tools for writers of all skill levels.</p>",2024-01-10,"AI,Web App"
fixmate,FixMate,/fixmate.svg?height=64&width=64&query=fixmatelogo,/portfolio-images/gigs-8.png,Smart solutions for faster repairs and tracking.,https://example.com,"<h3>Project Overview</h3><p><strong>FixMate</strong> is a comprehensive platform designed to streamline service requests and maintenance management for businesses and households. Users can easily log repair requests, track technician assignments, and receive real-time updates. The system intelligently prioritizes tasks, manages schedules, and ensures seamless communication between clients and service providers. <strong>Due to NDA constraints, the actual project name and UI images cannot be disclosed.</strong></p> <h3>Key Features</h3> <ul> <li>Service request logging with real-time updates</li> <li>Intelligent task prioritization and scheduling</li> <li>Technician assignment and tracking system</li> <li>In-app communication between clients and service providers</li> <li>Automated reminders and follow-ups for pending tasks</li> <li>Detailed reporting and analytics for service performance</li> <li>Secure, end-to-end workflow management for maintenance operations</li> </ul> <h3>Technologies Used</h3> <p>The platform is built using Next.js, Node.js, Supabase, and Firebase for real-time updates and secure storage. It integrates notification systems, analytics dashboards, and robust workflow management tools to ensure efficient service delivery and client satisfaction.</p>",2024-01-05,"Mobile App, Ai"
golden-events,Golden Events,/event.svg?height=64&width=64&query=golden events logo,/portfolio-images/gigs-7.png,Personal finance management dashboard with investment tracking,https://example.com,"<h3>Project Overview</h3><p><strong>GoldenEvents</strong> is a user-friendly event booking platform designed specifically for elderly users, making it easy to discover, register, and attend community events. The platform provides an intuitive interface with large fonts, simple navigation, and voice-assisted features. Users can browse events by category, date, or location, receive reminders, and get real-time updates about their registrations. <strong>Due to NDA constraints, the actual project name and UI images cannot be disclosed.</strong></p> <h3>Key Features</h3> <ul> <li>Intuitive, senior-friendly interface with large fonts and clear navigation</li> <li>Event discovery by category, date, or location</li> <li>Simple registration and booking process for events</li> <li>Voice-assisted navigation and accessibility features</li> <li>Automated reminders and notifications for upcoming events</li> <li>Real-time updates on event changes or cancellations</li> <li>Secure storage of user profiles and booking history</li> </ul> <h3>Technologies Used</h3> <p>The platform is built using React Native, Node.js, Supabase, and Firebase for real-time notifications. It supports accessibility features, secure storage of user data, and seamless event management to ensure a hassle-free experience for elderly users.</p>",2023-12-20,Mobile App
grocery-ecom-platform,Grocery E-commerce Platform,/ecommerce.svg?height=64&width=64&query=grocery ecommerce logo,/portfolio-images/17.png,Smart UI for hassle-free grocery shopping,https://example.com,"<h3>Project Overview</h3><p>A user-friendly e-commerce platform for grocery shopping, designed to simplify the online grocery experience. Features include intuitive product browsing, smart search and filters, seamless checkout, and personalized recommendations. The UI is optimized for mobile and desktop, providing a fast and enjoyable shopping experience.</p> <h3>Key Features</h3> <ul> <li>Intuitive navigation and product categorization</li> <li>Smart search and filter options</li> <li>Personalized product recommendations</li> <li>Smooth, multi-step checkout</li> <li>Mobile-responsive design</li> </ul> <h3>Technologies Used</h3> <p>Figma, Adobe XD, React, Next.js</p> <p><strong>One-Line:</strong> Smart UI for hassle-free grocery shopping</p>",2023-12-15,"UI/UX, Mobile App"
electrical-ecom-platform,Electrical Shop E-commerce Platform,/ecommerce.svg?height=64&width=64&query=electrical ecommerce logo,/portfolio-images/18.png,Effortless shopping for electrical products,https://example.com,"<h3>Project Overview</h3><p>A modern e-commerce solution for electrical shops, focusing on easy browsing, product comparison, and quick checkout. Designed with user experience in mind, it helps customers find products quickly while providing clear information, pricing, and stock availability. Mobile-friendly and visually engaging for higher conversions.</p> <h3>Key Features</h3> <ul> <li>Easy product browsing and comparison</li> <li>Detailed product information and specs</li> <li>Quick and secure checkout process</li> <li>Mobile-optimized responsive design</li> <li>Promotional banners and offers integration</li> </ul> <h3>Technologies Used</h3> <p>Figma, Adobe XD, React, Next.js</p> <p><strong>One-Line:</strong> Effortless shopping for electrical products</p>",2023-12-01,"UI/UX, Web App"
